{
  "$id": "https://aicostbudget.com/schema/model-lifecycle-evidence.schema.json",
  "$schema": "https://json-schema.org/draft/2020-12/schema",
  "description": "Local normalization is distinct from the observed official label. This schema does not perform live official-source verification.",
  "items": {
    "additionalProperties": false,
    "properties": {
      "canonicalInternalId": {
        "const": "openai/gpt-4.1-mini",
        "type": "string"
      },
      "deprecationEvidenceResult": {
        "const": "not_listed",
        "type": "string"
      },
      "documentedSnapshotIds": {
        "items": {
          "const": "gpt-4.1-mini-2025-04-14",
          "type": "string"
        },
        "maxItems": 1,
        "minItems": 1,
        "type": "array",
        "uniqueItems": true
      },
      "evidenceScope": {
        "const": "AICostBudget lifecycle normalization from official model documentation and deprecations only; not pricing verification, calculation eligibility, access, identity binding, or account entitlement.",
        "type": "string"
      },
      "lifecycleCheckedAt": {
        "format": "date-time",
        "pattern": "^\\d{4}-\\d{2}-\\d{2}T\\d{2}:\\d{2}:\\d{2}(\\.\\d+)?Z$",
        "type": "string"
      },
      "modelId": {
        "const": "gpt-4.1-mini",
        "type": "string"
      },
      "normalizedLifecycleStatus": {
        "const": "active",
        "type": "string"
      },
      "observedModelLabel": {
        "const": "Default",
        "type": "string"
      },
      "officialDeprecationsUrl": {
        "const": "https://developers.openai.com/api/docs/deprecations",
        "type": "string"
      },
      "officialModelUrl": {
        "const": "https://developers.openai.com/api/docs/models/gpt-4.1-mini",
        "type": "string"
      },
      "providerId": {
        "const": "openai",
        "type": "string"
      }
    },
    "required": [
      "providerId",
      "modelId",
      "canonicalInternalId",
      "officialModelUrl",
      "officialDeprecationsUrl",
      "observedModelLabel",
      "documentedSnapshotIds",
      "deprecationEvidenceResult",
      "normalizedLifecycleStatus",
      "lifecycleCheckedAt",
      "evidenceScope"
    ],
    "type": "object"
  },
  "maxItems": 1,
  "minItems": 1,
  "title": "Reviewed Website-only lifecycle authority (mini only)",
  "type": "array"
}
