[
  {
    "canonicalInternalId": "openai/gpt-4.1-mini",
    "deprecationEvidenceResult": "not_listed",
    "documentedSnapshotIds": [
      "gpt-4.1-mini-2025-04-14"
    ],
    "evidenceScope": "AICostBudget lifecycle normalization from official model documentation and deprecations only; not pricing verification, calculation eligibility, access, identity binding, or account entitlement.",
    "lifecycleCheckedAt": "2026-10-09T04:06:13.3973307Z",
    "modelId": "gpt-4.1-mini",
    "normalizedLifecycleStatus": "active",
    "observedModelLabel": "Default",
    "officialDeprecationsUrl": "https://developers.openai.com/api/docs/deprecations",
    "officialModelUrl": "https://developers.openai.com/api/docs/models/gpt-4.1-mini",
    "providerId": "openai"
  }
]
